,PRODUCTCODE,pdt_inclexcl_ENG_CONTENT,pdt_product_detail_PRODUCTDESCRIPTION,pdt_inclexcl_ENG_CONTENT_lang
50,100594P2,Guide service,"You will discover the classical Paris in an involving, informative and easy-going way with Guillaume.",es
142,101102P2,Funiculars and cable cars,"Montserrat is Catalunya's pride ( and my favorite place to be) , a very interesting shaped mountain with its famous monastery that became world's favorite pilgrim place. The home of the Black Madonna and a part of the famous Santiago de Compostela pilgrim route . The monastery situated almost on the peak provides us with a spectacular view and an incredible nature . The Benedictine monks produce some extraordinary liqueurs using local herbs and fruits and their cuisine is also a culinary delight. Don't miss the opportunity to hear the most famous children choir ""Escolania"" and visit the very interesting museum of the monastery . . We can optionally use the local Cog-railway to the peak of Montserrat mountain and also have some free time for hiking if you love nature ! I can create a customized tour for you in case you have any special requests ( like , adding a wine tasting of the great Penedes denomination origin) or if you are more than 6 people and need a larger vehicle !",ca
152,101116P8,Local Guide ,"Have you ever wondered which is the most artistic part of Paris? Of course Montmartre is. By choosing this amazing tour you will experience the most bohemian district of all time and you will walk through the streets where the greatest artists lived : Renoir, Picasso, Van Gogh but also the famous singer Edith Piaf!

Our private tour with the very experienced and capturing Alberto and his team members will make you fall in love with this district. You will walk through the amazing narrow streets where the oldest cafes and galleries in the entire Paris are and also see and old Windmill and Vineyard in the middle of Paris.

Obviously Alberto or one of his team will show you the Sacre-Coeur Basilic which is one of the most famous places of Paris and from up there you'll have a marvellous view over Paris!

This amazing tour will make you bounce directly into the past thanks to this terrific old district of Paris told by local guide Alberto or one of his wonderful team! ",es
168,101382P1,Local guide,"Join a walking tour to discover the Georgetown, Texas hiding beyond its facades 
 • Discover the stories hiding just out of reach of thousands of visitors and residents.
 • Explore the human events that have shaped and continue to shape this unique Austin-area community.
 • Experience the attractions of Georgetown’s historic downtown district and why it's considered the “Most Beautiful Town Square in Texas”.
 • Enjoy connections to Georgetown, Texas even many locals overlook.

This is more than a history or sightseeing tour. We take you on a walking journey to discover, experience and connect with the Georgetown, Texas hiding beyond its facades. You will walk among its historic buildings to discover stories both past and present as well as get insider tips on restaurants, shops, and live music venues.",es
172,101505P2,Experience guide ; Food & Drinks,"Take a stroll through the 19th-century with a guide hand-picked by The Bowery Boys New York City history podcast. Join this unique tour of the once elegant Bond Street NOHO neighborhood, former home to some of New York’s most famous families. You’ll learn how the neighborhood from the Bowery to Washington Square evolved into an enclave of the rich and famous, as well as the fringes of the 19th-century underbelly.

Your expert guide Carl will lead you along 19th-century cobblestone streets and introduce you to characters in this real-life drama, such as John Jacob Astor, Washington Irving, Charles Dickens, Edgar Allan Poe, Mrs. Astor, and Edith Wharton.

Our tour will pass by such New York landmarks as the famous Colonnade Row, the Public Theater, and Cooper Union. You’ll also imagine the drama that unfolded on today’s Astor Place during the Opera House riot of 1847.

We’ll visit the site of the notorious 1857 Bond St. Murder, which remains one of New York’s unsolved murder mysteries!",nl
173,101505P3,Experienced guide ; Gratuities,"Take a tour of Ladies’ Mile with a guide hand-picked by The Bowery Boys New York City history podcast. In the 19th-century, this neighborhood was New York’s most famous shopping district, where splendid commercial palaces plied their wares to the city’s elite. Some of the greatest architects and artists of the time created lavish showrooms to entice and delight both shoppers and passers-by. 

Your expert guide Emma will lead you around the neighborhood now known as Chelsea and the Flatiron District to see where wealthy women could shop without male companions. Residents of this neighborhood, such as Isabella Stewart Gardner, Edith Wharton, Samuel Morse, and members of the Roosevelt family.

The buildings of the Ladies’ Mile district includes some of the most important examples of lavish cast-iron architecture in New York City. We'll discuss the incredible architecture that still exists today, and examine how these department stores changed New York.",ro
181,101564P13,Blanket ,"Enjoy a tranquil horse carriage ride through Central Park to reach one of the iconic restaurants in the park. You have the option to get off at The Leob Boathouse Restaurant or at Tavern on the Green. There's nothing quite as romantic as a scenic horse carriage ride through New York City's Central Park. With this private carriage tour, take an idyllic loop through the south side of the park. Enjoy the clip-clop of horse's hooves as you pass several of the park's most memorable sights, including the famous carousel and outdoor ice skating rink. At the end of your ride, hop out at the Loeb Boathouse Restaurant, and enjoy fantastic views of the lake.",da
306,103084P4,Paddle board,"VIATOR Premium Private Experience, EXCLUSIVELY.
This is a perfect option to see the skyline of Barcelona and its surroundings like never before. Bathe in the high seas, practice a little paddle surfing or simply listen to music from your own Spotify playlist. All this is always included in our experiences!

If you book with us we guarantee professionalism, quality and exclusive service

The catamaran is a very suitable boat for people who have a tendency to get dizzy.
It is very stable and allows you to enjoy much more space while browsing.
It has three floors, cabins, deck and the Fly.
Our goal is that you never miss anything on the boat, we want it to be your most special day in Barcelona.
",cy
578,103241P3,Horse Carriage Ride,"TREATING YOU TO THE BEST CENTRAL PARK HORSE AND CARRIAGE RIDES

Whether you are searching for romantic things to do in New York, planning a date or planning a wedding, Central Park Horses will ensure you and your guests receive the most beautiful New York experience possible. See the city like never before with Central Park Horses",nl
584,103241P9,Carriage Ride,"This tour specifically stop at Strawberry Fields and has clear view of John Lennon's House.
Also Includes sightseeing of the following attractions. 
Ice Skating
Carousel
Dairy House
Balto's Statue
Ramsey Playfield (Summer Stage)
Conservatory Water
The Bandshell
BETHESDA TERRACE AND FOUNTAIN 
Cherry Hill
The Lake
Stop at Strawberry Fields
The Dakota building where John Lennon lived in
Tavern on the Green 
Sheep Meadow and Columbus Circle.

",pt
655,10428P20,Tour Guide; Gratuities,"Escape the hustle and bustle of Austin for a fun-filled trip to the Texas Hill Country! The Fitzhugh district of the Texas Hill Country approx. 35-45 minutes southwest of Austin. Hop on this half-day shuttle to spend the afternoon sampling craft beer and spirits at three (3) of the best breweries and distilleries in the area: Beerburg Brewing, Treaty Oak Distilling and Family Business Beer Co.

We’ll be your designated driver! A friendly local guide will escort you in a comfortable Mercedes Sprinter van. Plus, be sure to come hungry because each spot also offers a mouth-watering menu of delicious food options like pizza, tacos, and BBQ. Food and drinks not included.",fr
656,10428P22,Tour Guide,"Join us on our BBQ and Brew Shuttle and discover the hidden gems of Austin's BBQ and craft beer scene! We'll take you to one of the city's best-kept secrets for a delectable BBQ experience, followed by visits to two carefully selected craft breweries. Indulge in mouthwatering BBQ and sample a variety of handcrafted brews, as we transport you between these hidden gems. Our 4-hour shuttle experience, priced at $60 per person, offers the perfect opportunity to explore the flavors and vibes of Austin. Don't miss out on this exciting and delicious tour!
",fr
684,104883P65,Expert guide; Food tastings; Small group tour; Drinks; Gratuities,"This 2.5-hour Street Food Tour is a paradise for foodies: enjoy the chance to stroll through the charming center of Barcelona while you taste the authentic flavors of the city. Meet your food-expert guide at the iconic local market La Boqueria and sample some typical Catalan recipes like a local! Thanks to the variety of this multicultural cuisine, you can choose between sweet and savory treats such as jàmon, cheese, fried fish, pichos, patatas bravas and pastries. The tour ends in the Gothic Quarter, where you will admire the enchanting little alleyways of one of the most authentic parts of the city.",af
769,105229P5,Gratuities,"Venture into the Bohemian heart of Paris. The melting pot of Van Gogh, Picasso and Dali, the footsteps of Toulouse Lautrec, the quaint French café scene and the hidden vineyards - they are all here to be uncovered on this private tour. The narrow cobbled streets will become our playground as we explore the creativity, community and quirky secrets of one of the most unique areas of the City. Guarded by the shadow of Sacre Coeur, we will encounter water colours, portrait sketchers and caricaturists. There's a cabaret scene, the oldest can-can dance theatre in Paris, a chance hear nostalgic tunes hearkening to a bygone Paris era, plenty of stories, history and a taste or Bohemia and culture at their very best. Your hand picked guide will make sure this tour is not just insightful but entertaining and engaging. We want you to see Montmartre through our eyes so that you will see something truly beautiful. Bienvenue - let's go!",af
780,105237P5,Driver/guide; Bebidas alcoólicas (disponíveis para compra)," Guided tour of Mont-Saint-Michel, leaving from Paris

 Lunch in an authentic restaurant offering an exceptional view of the Mont

 Vegetarian menu option available on request

 Take a walk around the village of Mont-Saint-Michel with an enthusiastic guide

 Guided tour of the Abbey with its magnificent cloisters

 Free time to admire the superb view of the bay and stroll through the picturesque streets",pt
796,106033P2,"Transport; Guide; Food, Drinks, Meals","Enjoy scenic views of pyrenees mountain by road trip to Andorra from Barcelona. During three hours journey to Andorra (Divided in 2 parts) you will stop by Baga a medieval village with rich heritage and then head to andorra after a short break. On your way to Andorra you will enjoy stunning views of pyrenees mountains and your guide would guide you about the history and heritage of villages of Pyrenees. After arriving Andorra you will have 4 hours for seeing beautiful valley, an old church, beautiful old village and duty free shopping. Your Guide will give all the information through the course of your journey.",nl
835,106631P166,Kid-friendly guide; Expert guide; Private Tour; Gratuities,"Explore the Orsay Museum with our fun and informative private tour designed for families with children.
Thanks to your skip-the-line tickets you will quickly enter inside one of the most important art galleries of Paris, with its huge collection of Impressionist and Post-Impressionist works of art.
You will see world-famous masterpieces, including Monet’s ‘Blue Water Lilies,’ Cézanne’s ‘Apples and Oranges' and Degas’ Ballet Classe.
Our professional kid-friendly guide will tell you interesting stories about these work and will make your family learn art and history in a playful way.
Everyone will be involved in many entertaining activities, such as quizzes, trivia and little games created for this interactive tour.
",af
853,107194P154,24/7 customer support.; A city exploration game available on your phone (Questo app).; A tour guide.,"Discover New York’s haunted landmarks and the horror stories behind them. As you solve challenges, the story unfolds and exact directions on your phone will guide you to the next location. Ready for an adventure?

Highlights:
1. Explore famous places in New York such as the Washington Square Arch, the Jefferson Market Library and lesser-known places.
2. Enjoy a uniquely crafted story brought to you by our talented writers.
3. Check out the theatre that was founded by a famous female American Poet
4. Discover the dark history of Manhattan’s corrupt political past, where skeletons still remain.
5. Try a new type of experience, the perfect mix between a tour, outdoor escape game, and treasure hunt.",fr
854,107194P156,A city exploration game available on your phone (Questo app).; 24/7 customer support.; A tour guide.,"Uncover the Downtown of the Most Haunted City in Texas! Find yourself face to face with the ghosts of Austin’s past, some of which are friendly, others not so much. Learn all about previous sightings, locations, and optimal ghost-spotting hours. Grab a companion and discover more about the dark past of the Capital City of Texas! 

Will you explore the haunts of Austin?

Highlights:
1. Explore historical places in Austin such as the Texas Capitol, the Texas Governor's Mansion and lesser-known places
2. Enjoy a uniquely crafted story brought to you by our talented writers.
3. Follow a little-known path of history that may connect America’s first serial killer to one of the most famed assassins of all time.
4. Explore the Haunted Hotels along 7th street.
5. Try a new type of experience, the perfect mix between a tour, outdoor escape game, and treasure hunt.",fr
885,107196P1,Lunch,"New York City was made for walking and here is your chance to step into a whole new world. We offer visitors a rare glimpse into the Hassidic community of Crown Heights, Brooklyn.

We meet and greet at a local library located at 305 Kingston Ave. Our first stop is usually the Chassidic Scribe where you will see the masterful creation of various religious artifacts and a firsthand glimpse into the creation of holy Judaica items. Then it's off to the world famous 770 synagogue and then to 4. Then we visit a women's ritual bathhouse and hear about the Chassidic approach to dating, marriage and intimacy and how the Mikvah is the foundation of it all. Then it's off to the Matzah Bakery we go and although this part of the tour is seasonal (October-April) you will actually be able to walk through the entire bakery and see the intricate baking process. 

The tour generally takes 3 hours. 

5.",it
914,107676P1,Small breakfast; Helmets; Tour video; Guide,"Your route starts and finishes at the meeting point: Woobikes experiences & rental, where you can have a coffee and croissant (included) to get some energy for the ride. After that you get on your eBike and start the adventure into the world of Barcelona and Gaudí!

Discover worldwide known places like Sagrada Familia and Las Ramblas, you will also meet other landmarks of Barcelona like Ciudadella park or Arc de Triomf as we travel between the different works of one of the greatest architects ever known!

We also include a video of your experience using a GoPro action camera!

Child seats are available as well :)",sv
917,107676P5,Helmets,The experience offers a unique insight of the city and special tapas from the vasque country! You will get a full understanding of the city's history and attractions!,fi
931,107859P496,Private guide,"Because Paris is even more beautiful at night come with me to discover some of the most amazing monuments of the city enlightened. From a magical rooftop view at 360 degrees to the sparkling Eiffel tower!

●Paris

●Night tour

●2.5 hours

●Walking tour

●Private tour.Only you and your host

●Including:Private guide

This is what makes this tour unique：

Enjoy magical rooftop views

Experience Paris by night with a local

Walk on the famous Champs Elysées

Learn interesting facts & stories

Marvel at the enlightened Eiffel tower

100% tailored tour to your wishes

Attention please:

It's easy to have full bookings in peak season. Please book as early as you can. The available booking will be confirmed within 24 hours, otherwise, it will be rejected and payment will be refunded instantly.

The reservation will be confirmed after paying the displaying deposit, and pay the final payment on arrival.",ro
977,107859P694,One-hour sightseeing river cruise,"This one-hour cruise will take you right through the heart of the Paris. You'll take in the City of Lights most famous sights from the water: the Louvre, Place de la Concord, the Musée D’Orsay and more. 

Hop on board this Seine River cruise and enjoy the capital of France from the deck of a boat. Departing from the foot of the Eiffel Tower, the cruise passes through the historical center of Paris, and offers spectacular views of the city's most iconic monuments - the Louvre, Notre-Dame Cathedral, and the Musée d’Orsay, among others.

Attention please:
It's easy to have fully bookings in peak season. Please book as early as you can. The available booking will be confirmed within 24 hours, otherwise, it will be rejected and payment will be refunded instantly.
",af
982,107859P701,Reserved access to the Musée d'Orsay - use museum Entrance 'C'+musée de l'Orangerie; Reserved access to the Musée d'Orsay - use museum Entrance 'C',"The Musée d'Orsay is home to France's national collection of Impressionist, Post-Impressionist and Art Nouveau works. Its richness and marvels make it one of the most culturally important museums in the world. This ticket gets you skip the line access to this treasure trove of important (and beautiful) art.

All of the works in the Musée d'Orsay are the product of the period 1848-1914, positioned between the works of the neighboring Louvre Museum's works, and the collection of the nearby Pompidou Centre.",fr
1041,108053P18,HELMET; maximum travellers 7,"In this tour you will visit the Salt Mountain in Cardona.

Is a unique natural phenomenon in the world and is still growing as the rain erodes it.

Its height of 120 metres is just the tip of a big diapir with a depth of nearly two kilometres.

For one hour, you will descend to a depth of 86 metres and enjoy the spectacle of the shapes and textures of the salt massif, its white stalactites and stalagmites.

The former mining complex is now the Salt Mountain Cultural Park, a large cultural facility intended to inform the public about the importance of salt, the site’s exceptional geology and the use that people have made of this natural resource for centuries.

This is a private tour, except during the visit at the SALT MOUNTAIN, which will be a maximum of 30 people.",sv
1046,108053P23,extra stops,"We offer transfer service from Salou, or Port Aventura or La Pineda to Barcelona city, Barcelona airport or Barcelona port terminals. And also posible to make the transfer on the other way from Barcelona to Salou.
Private transfers with luxury Mercedes Benz cars and minivans up to 7 passengers. Our minivans Mercedes V class has 7 passengers seats and trunk capacity for 7 suitcases and 2 or 3 cabin bags or trolleys.",ro
1126,108889P17,professional guide service private tour; transportation,"In 1900 Montmartre was the world capital of artists. Your professional guide will explain to you why Picasso, Van Gogh, Renoir, Degas, Toulouse Lautrec used to live their. You will discover where they used to live and some artists studios. You will love the charming streets & atmosphere. Montmartre disctrict is still appearing like a little French village. You will visit also the amazing Sacred heart basilica. The second most important church in Paris. You will be impressed by its mosaics (the biggest in France). From the top oft he hill you will have one of the greatest views over Paris. With your private guide you it will be easy to spot all the major Parisian monuments you will see. This tour is a fantastic opportunity for all the art lovers who want to discover in more depth history of impressionist & modern artists. ",fr
1130,108889P20,Private driver Mercedes Van; private guide,"You will enjoy the comfort of this excursion with private guide + chauffeur Vehicle Mercedes Van.

Discover one of the greatest Cathedrals in the world and its 2,700 square meters of medieval stained glass windows.
",ro
1131,108889P21,Tour Guide,"private tour with a professional & experienced guide. You will visit at your own pace an be able to ask everything you wanted about Egypt & the pharaohs. 
",fr
1142,108889P32,lecturer guide,"A visit which combines 2 of the the greatest monuments in Paris : Sainte Chapelle & Conciergerie.
A real adventure through Medieval & Revolution times.
Discover the amazing stained glass windows which belong to the greatest in Europe. Admire their beauty and learn about their message.
It is a private tour. You can ask your lecturer guide all the questions you want and learn more about French history, arts, architecture & religion.
",fr
1184,10913P41,Tickets at Château de Fontainebleau,"A nice tour to Fontainebleau Castle is located about 60 km south-east of Paris. It served as the residence of the French kings for seven centuries, from Francois I to Napoleon III. Many crowned people of Europe came here, including Emperor Peter I and Pope Pius VII. Here Napoleon was saying goodbye to his army during his first abdication from the throne, and from there he went to the island of Elba. The castle and its garden are listed as a UNESCO World Heritage Site. You have the chance to visit the luxurious, recently updated apartments of Napoleon III. Optionally, the tour can be combined with a visit to the nearby castle - Vaux le-Vicomte, which inspired Louis XIV to build Versailles.",fr
1208,109713P6,Rafraîchissements légers; Prise en charge et retour à l'hôtel; Headsets to hear the guide clearly; Guide professionnel; Lunch,Discover the entire region of Versailles. Find your driver in front of your hotel. You will then be able to discover the majestic castle and its gardens. Adjustable schedule at your own pace.,fr
1395,110975P18,Private guide,"Ready to know the must-see places of the Antique Barcelona? Your private guide will dip you into the history of the walled city, guiding you through narrow passages full of past & secrets and telling you their captivating stories, avoiding the dense tourist crowd.
Visit in this private city tour the three Old Quarters of the medieval Barcelona: The Gothic Quarter, Raval and Born, where some buildings remain unchanged, others instead show the influence of the Modernist Architecture. You will visit the roman walls, historical buildings, and hidden squares. 
A ‘tapa’ accompanied with a glass of Red Wine in a local tavern are included!
Book now this amazing tour with a private guide, just for you.

- Walk throught the medieval quarters.
- Private Walking tour, just you and your guide
- Discover the hidden highlights of Barcelona.
- Listen incredible stories from your local guide.
- 1 stop in a traditional bar
- A tapa and a traditional drink included.
- 100 % private city tour.
",it
1470,111483P1,Tickets,"The history of the Louvre Museum is magnificent. Its rich art collection is of unfathomable proportions. The Louvre can be a mind-boggling experience. During our visit, I suggest a straight-forward approach!",sv
1476,111586P1, Private guide; Transport;  Tips,"I have just retired as an executive in Industry. Now that I have the time to do it, I would like to share my knowledge of Paris and have been born in Paris and lived my entire life in the historical center. I still live there today and have a lot of cultural life, events and places to go. I have traveled extensively throughout the world during my business life in North America, Europe and Asia, on my own, with my family or colleagues. I often found it difficult to find a guide that would make me better understand the history of the place I visited in greater depth. For this reason, I feel that I can offer something more than just basic guidance. I have a passion for History, Opera and Theater. My car can be made available for your visits in Paris at no extra cost.
",ro
1481,111736P11,Personal certified guide,"The tour starts at Central Park south and you will see the east of Central Park and you also see 
-Jose Julian Martin Statue, 
-Heckscher Playground from Jessie TV show
-Driprock Arch
-Chess and Checkers
-Dairy Visitor Center & Gift Shop
-Wollman Ring
-Central Park Zoo
-Gapstow Bridge from Home Alone 2 Movie 
-Plaza Hotel
-Balto Statue
-The Mall and Literary Walk
-Summer Stage

The Loeb Boathouse
-Bethesda Fountain
-Friends Fountain and Take one stop for photos
-Bow Bridge
-Wagner Cove
-Strawberry Field and Central Park West
-Tavern on the Green Restaurant
-Sheep Meadow
-Pinebank Arch Bridge from Elf",es
1547,113836P2,gloves; helmet,"Attractive price: Paris cheapest rental agency.

Competitive price: Rent of scooter 125cc the cheapest

Equipment: supplied with a top case and a lock

Comfort: 2 places on the vehicle",da
