,PRODUCTCODE,pdt_inclexcl_ENG_CONTENT,pdt_product_detail_PRODUCTDESCRIPTION,pdt_inclexcl_ENG_CONTENT_lang
14124,38962P1,"Paradas de descanzo en ruta; Guia de habla español; Museo Aire Y espacio En el caso de querer visitar deberan hacer reserva con museo online; Se permite llevar maleta y dejar el tour en Washington; Parada en Washington 90 minutos 14:00-15:30 para caminar, almorzar o visitar museos",Visita a la ciudad de Washington en Español - Viajando con guias profesionales y aprovechando al maximo su tiempo en Washington,es
14245,394285P7,E-Scooter; Helmet; Guide,"The only way to start your Paris adventure is with an E-Scooter tour along the Seine river. Discover the city's most iconic sites & 2000-year history with your expert guide! 
This Paris E-Scooter tour covers the city's most important landmarks from Notre-Dame all the way to the Eiffel Tower, passing through the most important monuments Paris has to offer. 
Your guide will make sure you stop in the perfect spots so you can take amazing photographs and of course our guides will be very keen to take your pics with breathtaking Parisian views in the background. 
The route is very safe as we only use the legal bike and E-Scooter lanes of the city. 
This E-Scooter tour is a great way to get your bearings, take the most memorable pics of the city and learn about its history and monuments.
The finest way to discover Paris!

",nl
14262,394811P4,Gratuities ; Food and drink,"Avoid the stress to find a cab or to use the public transport to get to the Paris Airports. With this private transfer to Orly or Charles de Gaulle Airport, your driver will pick you up at your hotel and he will take you to the any Paris airport on a comfortable Car or Minvan. ",af
14264,394855P1,Your equipment.,"The summary of Paris and its famous monuments

All the famous historical monuments in 2h30! This great tour, by rallying one by one all the most famous monuments of the city, also allows you to cross a great diversity of Parisian districts. The leisurely pace of our electric tuktuks allows a few short photo stops to make a first full of memories! Our tours are guided, the goal is not only to see, but also to learn about this city and its history.",fr
14265,394855P2,Stroller,"Do you already know the monuments where you would prefer an original route to the clichés of the tourist routes of typical Paris deja-vu? These towers are for you!

The “Unusual Paris” tours are not typical tours. These tours will take you away from famous statues, churches and monuments, and introduce you to an unexpected, yet delightful side to the capital. Our Parisian drivers, and passionate about history, will show you lots of life and novelties and little hidden corners of paradise.

Have you heard of: The City of Flowers? The arenas of Lutèce? The Butte aux Cailles? The Alligre market? The Campaign in Paris? the entrances to the catacombs?
soon yes! It's a really fun way to discover the other side of Paris, by Parisians.
",da
14266,394855P3,Stroller,"Super fun family trip
If more than 500 families have already traveled on the Super Fun Family trip, the reference for family trips to Paris, shared by the main national media, it is also because we have been able to remain on a human scale to share our city.
We offer tours to discover Paris with the family and get to know this city better while having fun, in an electric tuktuk, the ideal tool to design your personalized tour in all corners of this city, from the best known to the most unexpected.

Visit Paris and also share its history, its diversity in a personalized tour with our small team of cool Parisian drivers and history enthusiasts who will know how to orient their tours for children: crossing a park, a stop at a garden children, a good pancake on the way, a family friendly restaurant, we program you a 2h30 course up to a tailor-made program of 8 hours cool friendly and instructive.",da
14267,394855P4,Your equipment.,"The summary of Paris and its famous monuments

All the famous historical monuments by night! This great tour of Paris, rallying one by one all the most famous monuments of the city. Whether for a party with friends, a birthday or a romantic ride, the tuktuk will make your evening original and memorable. Music, champagne and karaoke are available on request!

",fr
14321,398676P1,Helmets,"Discover the very best of Barcelona, on this 4-hour electric bike tour that takes in everything from La Sagrada Familia to the Olympic Stadium and the palm tree-lined Barceloneta beach. Take epic photos of the city from Montjuic mountain, and in front of Gaudi’s mind-bending mansions. No bike tour goes further!",fi
14349,399483P1,APPLICATION ,"Discover the city's heartbeat through the lens of a professional theater team, making this audio tour an unforgettable experience!
 What to Expect:
Immerse yourself in a captivating plot woven from the stories of locals from both the past and present.
Explore 50 fascinating places, ranging from iconic landmarks to hidden gems.
Feel the spirit and contrasts of the city through the lens of history, music, art, and love.
Let the cinematic soundscapes transport you into the very heart of Barcelona.
 How to Join:
Prepare your smartphone and headphones.
Download the Stereo Story application.
Follow the voices of our skilled actors as they guide you through the city's wonders.

 Get the App:
Find our app in your phone's market: Stereo Story
️ Languages Available:
Spanish, English, French 
",tl
14362,399927P1,Guide,"We have worked in the tourism sector for several years, and all share a crazy love for the most beautiful city in the world, Paris, as well as 2CVs.",es
14376,401139P10,Beverages; Gratuities,"Embarking on a romantic dinner at Roberts Restaurant in Columbus Circle, New York, is an enchanting experience that blends exquisite cuisine with breathtaking views of the city. As you enter the restaurant, you are immediately captivated by the elegant and intimate atmosphere, adorned with soft lighting, plush furnishings, and panoramic windows that offer stunning vistas of the iconic Columbus Circle. The menu at Roberts Restaurant boasts a fusion of contemporary American and European flavors, prepared with the utmost attention to detail. From succulent seafood to perfectly cooked steaks and innovative vegetarian dishes, each plate is a work of art, showcasing the finest seasonal ingredients and creative culinary techniques.

As you and your partner relish the delectable flavors and toast to your love, the mesmerizing views of the New York City skyline create an unforgettable backdrop, turning your dinner into a truly magical experience. ",af
14397,401766P3,Tour Guide,"The tour will show the best sight-lines of two of New York's most iconic bridges! Starting in Manhattan's Chinatown we will walk both the Manhattan and Brooklyn Bridge, then ending at City Hall. We will have plenty of stops along the way for breathtaking pictures!

The tour is approximately 4 miles and will take about 2-3 hours to complete.

This is a public group tour and you might be matched with other random parties. I always believe the more the merrier, but if you prefer a private tour with me and your own party please choose ""Private Brooklyn and Manhattan Bridges Walking Tour""!",fr
14491,404289P1,"sketchbook, pencils, markers","Drawing & illustration workshop in some of the most beautiful gardens of Barcelona, on Montjuic hill, with spectacular views over the city. 

We will visit different gardens and will stop in each of them to draw nature, plants, flowers... No need to know how to draw!
We will start at the Historic Botanical Garden which hosts the tallest trees of Barcelona. We will then head either to the Joan Maragall gardens, either to the Laribal gardens, depending on the season.

You will learn techniques and tips from a local illustrator, Caroline Selmes, and learn about Montjuic and its history.
Instagram : @carolineselmes 
@wild_pencils

It's a great way to explore a less known side of the city, at a slower pace, enjoy nature and be creative. Montjuic is also a cooler area in summer.

Everything is included: coffee and tea to start the day, material to draw (pencils, poscas pens) and sketchbook to take back home.

Bring a bottle of water, solar protection and comfortable shoes.

",da
14502,404438P1,Parking on-site,"Best Place Farms is home to KuneKune's, pronounced “kooney kooney”, a rare breed of pig that nearly went extinct in the 1970's. They're considered one of the most docile pig breeds, making them amazing pets and great for human interaction. Come meet our KuneKune's and learn why we love them so much! 

You will also get to meet and interact with the other animals in the farm.",fi
14522,405318P3,Cleaning (€30),"Explore the crystal clear waters of Barcelona aboard the incredible Gobbi Atlantis 315 luxury yacht. Embark on an unforgettable experience! Away from the bustle of the city, discover the true meaning of sailing aboard a luxury yacht.

This impressive boat offers high-end amenities that will make you feel like you are in a dream. Relax in the large bow and stern sundecks. Enjoy a spacious double cabin, a fully equipped kitchen and a complete bathroom with shower. In addition, throughout your experience on board, we will offer you a selection of delicious snacks and drinks so that you do not miss anything.

· Large solariums in the bow and stern to relax to the fullest.
· Enjoy a meal al fresco at the outdoor dining table.
· Comfortable double cabin with matrimonial bed.
· Enjoy hot water at all times.
· Complete bathroom and toilets on board.
· Keep your devices charged with 220V power outlets.",tl
14528,405358P1,"PEARLS, FINISHES, CHAIN IN GOLD AND SILVER PLATED","Learn how to create a precious costume jewel with professional Parisian designers in a pretty boutique-workshop in the Trocadéro district!
The workshop takes place in two stages, first the creation, then the manufacturing.
To start, we show you several models of jewelry to inspire you. You can decide what you want to create: necklace, bracelet or earrings.
Then you select the pearls you like, the findings, the chains from a wide choice. Creation is completely free. We are here to help you every step of the way.
The second part of the workshop is devoted to the assembly of the jewel. We teach you the manufacturing techniques: how to use flat, round, cutting pliers... the technique of small junction rings or pigtail rods we tell you everything!

Whatever your level, everyone leaves with a beautiful handmade jewel!",de
14540,406074P4,Paddleboards; Paddles; Life jackets,"This area is the the best part of Downtown Austin and seeing it from the Giant Paddleboards is the only way to take it all in. 

People love this tour because you can customize your trip by including or avoiding all of the following in the same area:

Crystal Clear Refreshing Spring water thats great for swimming any day of the year 

Lots of great wildlife like birds, turtles, fish. 

People who are into adventure love the bridge jumps and rope swings along the side of the river and some people just like watching everyone else do those activities. 

There is plenty of ""party atmosphere"" along the river but its easy to avoid if you're not into that as well. 

There are family friendly swimming holes with shallow pools for kids 

There are alot of great photo opportunities with the downtown skyline and great natural springs, bridge jumps, and rope swings make for additional photo worthy moments. ",sv
14600,407854P1,Helmet,"A chill, easy going bike cruise that will give you an inside to Barcelona’s history, architecture, and metropolitan culture. Come experience Barcelona through the eyes of a local; A new friend who can tell you about the city’s deep history and show you the hidden gems of the city that many overlook. You’ll experience a ride from the beach to the backstreets, charming shops and plazas of romance. 
 A perfect introduction to an amazing city! A tour with something for everyone,Barcelona experts and new comers alike. The pace of the tour is laid back and the bikes are comfy, great for all ages and fitness levels. ",fi
14644,409997P1,Skirt,"By joining our introductory French Cancan course, you will also discover the fascinating history behind this dance. You will dive into the golden age of Parisian cabarets, where the dancers, nicknamed the ""cancaneuses"", broke social conventions by expressing their freedom through daring and fiery movements. You will be able to put yourself in their shoes, embody their audacity and feel the excitement of that bygone era.

This class is open to all levels, whether you are a curious beginner or an experienced dancer looking for a new challenge. You will be supervised by dance professionals who will share with you their expertise and their passion for this unique art form.

The French cancan is more than just a dance, it's a celebration of life, joy and self-liberation.",lt
14654,410590P3,Walking tour and guide.,"Take a thrilling journey though mob history on this walking tour in New York's Little Italy, where some of the most notorious events in American gangster lore took place.

Start with the violent tactics of early black hand gangs and the battles to control the liquor trade during prohibition, leading to the rise of Joe ""The Boss"" Masseria.

Learn how Lucky Luciano revolutionized organized crime with The Commission of Five Families and his unlikely deal with the government during World War Two.

See the infamous Ravenite Social Club and follow the rise and fall of Dapper Don John Gotti.

Meet Lieutenant Petrosino, an early crime fighter, and Frank Serpico, who risked his life to expose police corruption.

End with visits to the spots where mobsters ""Sally Bugs"" Briguglio and Crazy Joey Gallo met their bloody demise.

Optionally, see locations from The Godfather and continue to Five Points, the notorious neighborhood popularized by the film Gangs of New York.

Distance: 1 mile / 1.5 km",af
14655,410590P4,Walking tour and guide.,"Take a captivating walking tour of Lower Manhattan that traces New York's transformation from a Dutch colony to a modern metropolis.

Start with the tale of Manhattan's purchase for $24 in beads, then visit the site of a fort that changed hands between the Dutch and the British, and eventually saw the end of the American Revolution.

Explore the city's oldest park and see the iconic Charging Bull statue.

At Alexander Hamilton's resting place, relive the dramatic duel that ended his life.

Strolling down Wall Street, see The New York Stock Exchange and Federal Hall, the United States' first capitol.

Nearby, visit a building concealing $400 billion of gold beneath its foundations.

Passing through the city's first paved street, explore the footprints of a 17th-century tavern and the remnants of the old City Hall of New Amsterdam.

Conclude with a visit to the oldest tavern in New York, where George Washington bid farewell to his officers.

Distance: 1.5 miles / 2.5 km",af
14671,411190P1,Food and drink tastings,"The tour is a private food tour. a truly boutique experience. I don't conduct group tours.
Experience French food culture on an outstanding food tour with a French gastronomy expert. 
A tour with me is a multi-sensory experience of sights, smells, tastes, emotions, explanations, and stories. 

On the tour we will learn about French food culture up close. You will hear advice and tips useful for your Paris stay. We will visit special places, meet fascinating shops, experience quality and exciting tastings, we will show you how a Parisian distinguishes between an ordinary product and an excellent one, we will learn how to choose cheeses and know which are the finest, and more.

During the tour, we will visit an authentic non-touristy food market, fine gourmet shops in truly worthwhile places, often hidden, and sample a variety of fine tastings and worthwhile culinary purchases.
Food experts will provide you with professional explanations as well as travel and taste during this tour.

",af
14731,41393P10,Sightseeing Guide; Gratuity,"Join us on a journey through over four centuries as we walk down NYC’s oldest street! Originally a Native American footpath and Dutch farm road, site of the first free Black homesteads, it witnessed gang wars, the bloody Astor Place Riot, & Lincoln’s famous anti-slavery speech at Cooper Union. It was the working-class main street for sailors, shopgirls, gangs, gays, and waves of immigrant Irish, Italians, Germans, Jews, and Chinese. NYC’s first entertainment district, it has seminal links to tap dance, vaudeville, Yiddish theater, Houdini, Stephen Foster, Irving Berlin, Mae West, modern tattooing, Abstract Expressionism, Beat literature, improvisational jazz and punk rock. Though it declined in the 1900s, when flop houses and dive bars proliferated, it nonetheless became home to affordable jewelry, lighting, and restaurant supply stores, and a live-work home for artists like Marc Rothko, Maya Lin, William Burroughs, Robert Frank, and Debbie Harry. ",af
14746,414419P1,Guide; Tour; Appetizer,"We visited the surroundings of the Sagrada Familia Basilica, a majestic work by the Catalan architect Antoni Gaudi.

Holy Family

The Expiatory Temple of the Sagrada Familia is a Catholic Basilica in Barcelona. Built since 1882, with completion scheduled for 2034. It is Gaudí's masterpiece and the greatest exponent of Catalan modernist architecture.

The construction of the church is entirely financed by private donations and entrance fees from visitors to the church.

I carry out personalized tours and tours in Barcelona and surrounding areas.

Talk to @secretodebarcelona",fr
14751,41446P4,Food and drinks,"See the famous New York City skyline in an incredible new way! Our harbor tour begins at Pier 25 in Manhattan. Speed down the Hudson River and stop to circle the base of the historic Statue of Liberty. With speeds reaching 50 miles/hour, there will be plenty of time to slow down for some photos! Whether you are visiting or a native New Yorker, the tour is an unforgettable way to see the city like never before. Tickets are valid for one year from time of purchase and can be used for any departure date/time based on availability.",af
14815,41792P4,"Kayak, life jacket and wetsuit","The majority of visitors to Barcelona spend their days in the city, ticking the major sites off their lists and snapping some photos. How about doing something a little different and exploring a beautiful area that 99% of people never get to see! Our kayaking trip takes you out of the hustle and bustle of the city, reconnecting you with nature and creating some awesome memories.",af
14820,418071P1,Audio guide; Louvre museum entry ticket,"Visiting the Louvre Museum in Paris with an audio guide device unique is the opportunity it provides to enhance the museum experience. The audio guide offers valuable insights, stories, and information about the artworks and artifacts, adding depth and context to the visit. It allows travelers to personalize their exploration, learn at their own pace, and gain a deeper understanding and appreciation for the masterpieces housed within the museum's walls.",fr
14832,418857P1,Vintage photo keepsake,"First of all, it offers the possibility of discovering Paris at nightfall, thus allowing a better understanding of why it is nicknamed ""the city of light"". Famous landmarks are illuminated, providing an even more spectacular view than during the day.

Then you will have the opportunity to visit Paris aboard an authentic car from the 1980s, with vintage orange seats. You will become a star yourself, because passers-by will notice this small and charming car. You will often hear admiring comments such as ""she's beautiful!"" and you will even be photographed by other tourists.

During the car tour, I will take your picture with a vintage Polaroid camera. At the end of the tour, you will leave with paper prints of your photos (10 photos).",et
14883,41983P9,Food and drinks,Full day trip to the United Stated Military Academy at West Point which is sixty miles north of New York City.,af
14899,420543P4,Goodies from Paris Fun Tours; Knowledgeable local tour guide ; Entrance to Sacré-Coeur Basilica,"Step into the enchanting world of Montmartre with our curated tour where iconic landmarks like Montmartre and the Sacré-Cœur Basilica come to life. Wander through colorful streets, discover hidden gems like La Maison Rose, and embrace the artistic spirit of Place du Tertre. Our knowledgeable guide will share with you incredible stories weaving the rich history and cultural tapestry of this bohemian neighborhood. From the cinematic charm of Café des Deux Moulins to the serene Square Suzanne Buisson, every stop unveils a new chapter in the captivating story of Montmartre. Join us for a brief yet immersive experience that promises to reveal the essence of Parisian charm. Book now for a glimpse into the intriguing tales of Montmartre!",fr
14905,420790P1,Licensed NYC Tour Guide; Tour Guide Gratuity,"3 INDOOR restaurant tastings are included on this tour! At Foods of NY Tours we are the pioneers of NYC food tours since 1999!

Join us on a food tasting and cultural journey through the charming West Village. Discover why this area of the Village is the most sought after by celebrities and anyone looking for that Europeanesque lifestyle. The West Village is known for its charming mom and pop restaurants, well-known specialty food shops, cafes, and a variety of foodie hot spots.

During this tour you will taste mouthwatering foods from our favorite establishments while learning their back stories and seeing the charm and beauty of the West Village – secluded gardens, winding tree lined streets, stunning multi-million dollar houses from the 1800’s, classic immigrant tenement buildings, the narrowest house in NYC, and much much more! By the end of the tour you will understand why so many people fall in love with this quintessential NYC neighborhood. ",fr
14909,420790P5,Licensed NYC Tour Guide; Tour Guide Gratuity,"3 sit-down INDOOR tastings included with Foods of NY Tours!

Chinatown can definitely be intimidating, even for a native New Yorker! It’s a diverse neighborhood with historic landmarks, hidden side streets, delicious foods from all over Asia, and it’s home to one of the largest population of Chinese people in the western hemisphere. Join us as we share interesting stories, sights and delicious foods.

Where to eat in Chinatown can be overwhelming, so this is where we come in! Enjoy 3 mouthwatering sit-down tastings: 5 types of dim sum, authentic Peking Duck prepared as if you were in Beijing, and Malaysian street food. The tour also includes a modern and traditional dessert, representing two sides of a changing neighborhood. Join us for a memorable journey that will leave you with a deep understanding of the flavors, history, and confidence to navigate Manhattan’s Chinatown!

We visit 5 establishments, 3 of which we sit indoors with more tastings!",fr
14915,420878P1,E-bike ; Entrence,Barcelona bike night tours are a fantastic way to discover the city's vibrant streets and landmarks while enjoying the cool evening breeze. A unique view of Barcelona is revealed when the sun sets and the city comes alive with a different ambiance.,da
14917,420878P3,profesional guide,"On this exclusive tour, you will have the opportunity to explore the city's traditional Christmas market, immerse yourself in its Christmas customs and traditions, visit the most illuminated street, experience Christmas gastronomy, and much more. Get ready to embark on a wondrous journey through Barcelona's winter wonderland.

Beyond the festive celebrations, the tour delves into the captivating history of Barcelona, revealing hidden gems and offering tailored suggestions for experiencing the city's diverse culinary scene. Participants can expect to gain a deeper appreciation for the city's cultural heritage while savoring the authentic flavors of local cuisine.

Explore the enchanting Christmas traditions of Barcelona on our exclusive tour, featuring festive markets, traditional Catalan treats, and the city's vibrant seasonal celebrations.",es
14937,421206P1,Restaurant; Wine; Champagne,"Immerse in an extraordinary day !

Explore Moët & Chandon boutique. 

Visit the LVMH Mercier Champagne House cellars on board a train, and have lunch in a typical restaurant in the region !

Engage your senses in vineyard tastings . Step into captivating cellars, witness the craftsmanship of champagne production. Indulge a delightful lunch in a typical local restaurant, savor local delicacies, cheeses, baguettes, pattiseries with exquisite wines . Capture the magic with your camera, preserving unforgettable moments . Celebrate history, luxury, and natural beauty. Cheers to discovery, indulgence, and the effervescent magic of champagne! 

Note:
We will pick you up at your hotel, and after 1 hour of driving, we will arrive in the Champagne region to enjoy all the activities of the day.
After all these discoveries, we will get back on the road to take you back to your hotel.",fr
14945,421340P1,Boat,"A picturesque and serene getaway aboard a license-free boat from Melun.

Welcome to Melun, where an adventure on the Seine awaits you!

Why embark at Melun?
Embark on board our boats without a license and set off to discover the magnificent bourgeois houses ""Les affolantes"" which line the banks of the Seine river on the 3 hour round trip (2 hours without current / wind). This memorable experience offers you the opportunity to enjoy a moment of relaxation on the water, in a setting that is both pleasant and idyllic.",ro
