,PRODUCTCODE,pdt_inclexcl_ENG_CONTENT,pdt_product_detail_PRODUCTDESCRIPTION,pdt_inclexcl_ENG_CONTENT_lang
10405,270260P4,ticket for museum,"In this unique ""2 tours in 1"" we combine Montmartre with my favourite museum, Musée d’Orsay. We start in the birthplace of Impressionism. We see the place where Van Gogh has lived, where Renoir painted his masterpiece, Picasso’s studio, the Moulin Rouge of Toulouse-Lautrec. We finish at the Sacre Cœur where we enjoy a breath taking view over the city.

After tasting the atmosphere of this neighbourhood we move to Orsay to see paintings made in Montmartre. We walk through “the artistic heaven” incl. ""Déjeuner sur l’Herbe"" by Manet, ""Moulin de la Galette"" by Renoir, portraits of the Moulin Rouge stars by Toulouse Lautrec, Starry Night by Van Gogh.

Because of the stunning architecture of the old train station you can make some beautiful pictures of Paris. Through impressive pointers of the clock we see the Sacre Coeur in the background, where we were only 1 hour before. 
Special price (-25%) for children and youngsters, because I believe it’s important to stimulate them art and culture.",da
10414,270370P8,Audio guide,"Enjoy the Monastery at your own pace with two tours in an audio guide for your mobile phone. Two tours to discover the monastic complex and the Romanesque cloister.

You will learn about the history and architecture of the entire monumental complex with ""Feel the voice of the Monastery"" and you will discover the magnificent stories of the Romanesque capitals of the cloister with the ""Medieval stone book"".
",es
10419,271039P1,Harness,"Strong sensations and challenges guaranteed through various courses: Flea jumps, stirrups, rope bridges, climbing walls, zip lines, tarzan liana, jumping in the void. Our courses are totally secured with the continuous lifeline system.

If you love adrenaline, surpassing yourself and enjoying an unforgettable experience to reconnect with nature, you know what you have to do!
",no
10420,271039P4,Harness,"Immersed in the middle of the forest, you will venture on the trees in a green setting in the middle of nature! 

Thrills and challenges guaranteed through various courses: Flea jumps, stirrups, bridges of
ropes, climbing walls, zip lines, tarzan liana, quick jump. Our routes are totally
secured with the continuous lifeline system.
",no
10436,271552P2,Experienced Local Guide; Transport,"Do you only have morning or an afternoon in Barcelona? On this private guided walking tour with an expert, passionate and friendly guide you will visit all the essential places of the city in half a day.

In the first part we will start with a trip to old Barcelona. From Roman origins through medieval times in the famous Gothic Quarter, a labyrinth of small medieval streets rich in fantastic stories and details, where you can admire the best of Catalan medieval Gothic art: the churches, the palaces, the marks of the past.

After a 15-minute break, the second part of the visit will focus on 19th century and early 20th century Barcelona, ​​with the wonderful modernist palaces and the architectural grandeur of Antoni Gaudí, with Casa Batlló, La Pedrera and the emblematic Basilica of the Sagrada Familia. The best way to have the authentic Barcelona experience.",es
10437,271552P3,Experienced local Guide; Transport,"Discover the oldest part of Barcelona with an expert and friendly local guide. You will learn everything about our city's past in an entertaining and lively way. You will visit the most emblematic places to understand the history, culture and traditions of Barcelona and Catalonia. Medieval palaces and churches, neo-Gothic buildings and bridges, ancient Roman tombs and aqueducts for an unforgettable journey through Barcelona of the past.",es
10438,271552P4,Metro ticket to Sagrada Familia; Experienced Local Guide,"A guided walking tour of Modernist Barcelona architecture with an expert and passionate local guide. On this tour you will discover the most outstanding and surprising buildings that were built between the 19th and 20th centuries, such as Casa Milá, Casa Batlló the Sagrada Familia, and learn of the genius Antoni Gaudí . A journey into the luxury and madness of belle epoch Barcelona , among dragons, fairytale towers and secrets hidden at first sight.",es
10440,271552P7,Expert Local Guide,"In this fascinating night adventure in the company of a passionate local guide, we will relive the crazy Barcelona of a century ago, talking about the most emblematic sights and places of the Gothic Quarter and Raval district, an area formerly known as ""Chinatown"". Among tales about brothels, historic bars and hidden details, we will discover why Barcelona has become a famous and controversial place for nightlife.",ca
10479,274871P9,helmet if needed,"Discover Paris like never before on our extraordinary bike tour! Immerse yourself in the city's most iconic landmarks as we take you on a captivating journey through history and culture.

Starting at Île de la Cité, before pedaling towards the world-renowned Louvre Museum, home to timeless masterpieces including the enigmatic Mona Lisa. As we continue, marvel at the grandeur of Place de la Concorde, where history unfolds amidst impressive monuments and beautiful fountains.

Prepare to be enchanted by the majestic Grand Palais and cross the elegant Alexandre III Bridge. Of course, no trip to Paris is complete without a visit to the iconic Eiffel Tower. Our tour includes a delightful ride along the picturesque Seine River, providing a unique perspective of Paris' landmarks.

What sets us apart is our commitment to creating an intimate and immersive experience. Our expert guides ensure personalized attention and foster a sense of camaraderie among fellow adventurers.

Book now!!! 

",nl
10483,275837P10,Expert Guide,"Immerse yourself in the lives of prolific characters - some more famous than others - as our expert guide magically brings to life the men and women whose lives we immortalise.

From tombstone to sarcophagus, you’ll learn of the tragic love stories of the like of Héloise & Abélard (Romeo and Juliet), visit the tomb of Jim Morrison, see R-rated sculpture of Victoir Noir's effigy, lip-stick kiss covered tombstone of Oscar Wilde and more. (This experience can be adjusted to be kid-friendly)

Your expert & local guide will be waiting for you at the designated meeting point to take you for this light-hearted walk into the Père-Lachaise cemetery. Our unmatched storytelling approach and attention to delivering one-of-a-kind experiences are an absolute must-have once you have decided to visit the most famous and coveted burial grounds located in the 20th arrondissement of Paris.

We take pride in working with sizeable groups, so you'll have the full attention of our experienced guides.",ca
10495,276954P2,private ride; skipper or boat captain 100 euros,"Come and enjoy a sailing trip and discover a sailing adventure.

Spend the morning or afternoon with friends or family aboard the Aida.

Departures from Sitges to discover the Costa del Garraf or the Costa Dorada, stopping at some of its coves to anchor.

We can organize food and drinks for the day with a budget, or you can bring it too.
minimum 6 people and maximum 9 people",ro
10496,276954P3,private ride; skipper or captain €160,"Discover the Costa del Garraf, or the Costa Daurada aboard our sailboat Aida.
A full day with family or friends, including paddle surfing.
We can organize food and drinks on request, a beer tasting could be included.
You can also bring your things to eat and drink.
Minimum 6 pax to reserve and maximum 9 people",ro
10519,277392P2,Private guide; Entrance 4.30 Euros each Monument,"This private and picturesque walk alongside an experienced guide-lecturer will allow you to discover the history and heritage of the medieval city of Provins before returning to visit the various monuments (following restrictions linked to the fight against Covid-19 , monuments are closed until further notice. Consult the Tourist Office website for more information).",es
10523,278147P2,Boat,"Enjoy Luxury Boating at you finger tips on Lake Austin! Home to waterfront dining, celebrity homes, one of the best party coves in Texas, as well as the iconic Pennybacker bridge. This is the perfect setting for Lake Austin boat tours, and one of the best party lakes in Texas. Our Lake Austin Charter boat service picks up customers at the iconic 360-bridge boat ramp, which is a short 15-minute drive from downtown Austin. This is especially convenient for groups that are visiting Austin. Once on the water, what we do and where we go is totally up to you! Just tell your captain what you have in mind and they will take care of the rest.. Sit back and relax while your captain does all the work! ",ro
10524,278147P3,Boat,"Enjoy Luxury Boating at you finger tips on Lake Austin! Home to waterfront dining, celebrity homes, one of the best party coves in Texas, as well as the iconic Pennybacker bridge. This is the perfect setting for Lake Austin boat tours, and one of the best party lakes in Texas. Our Lake Austin Charter boat service picks up customers at the iconic 360-bridge boat ramp, which is a short 15-minute drive from downtown Austin. This is especially convenient for groups that are visiting Austin. Once on the water, what we do and where we go is totally up to you! Just tell your captain what you have in mind and they will take care of the rest.. Sit back and relax while your captain does all the work! 

We will bar hop on the lake, drive by celebrity houses, and enjoy a booze cruise on Lake Austin. If you would like to anchor up in the party cove and raft up next to party boats we can do that too!
",ro
10529,278397P1,Transport,"Let's get lost for a while among the boulevards and streets of Paris, among the flowering plane trees and priceless cultural sites. We will drive through the most majestic and iconic places of the city, plunge into its history, enjoy its beauty and indescribable charm, and also look into not the most famous, but the most atmospheric corners of Paris.",no
10563,281275P1,Luggage rack,We respect all the needs of our customers. We are always on time and our priority is your comfort. We only use new and luxury cars because we want to give you the best possible service.,sv
10568,281767P39,Entrance to Panthéon Paris,"Discover the Pantheon, The Temple of All Gods of Paris. Admire this beautiful historical monument from the inside too, not just the outside! Indulge in its rich history!",fr
10570,281767P42,all day entrance to Centre Pompidou,"Visit the biggest Modern Art museum of Europe, located in Paris. It also has a large public library, with our entrance you can get a fast entrance and spend at least half a day there.",es
10571,281767P43,entrance to Sainte Chapelle,"Admire Paris' most famous and beautiful Gothic church, the Sainte Chapelle from the inside! Learn the story about its magnificent windows! Save time with our skip-the-line entry tickets!",fr
10572,281767P48,all day entrance to Louvre Museum,"Explore the world's most famous and most visited museum, the Louvre Museum in Paris! At the ticket offices, there are usually 1-2 hours of waiting lines, save this valuable time with our tickets, and have more time for yourself!",fr
10573,281767P51,entrance to Casa Mila - La Pedrera,"Visit Casa Mila (La Pedrera) and you will enter the world of Antoni Gaudi and discover for yourself how nature is the origin and inspiration of the building.

Casa Mila, popularly known as La Pedrera, is a UNESCO World Heritage Site and the architect’s last civic architectural project. It is a unique building, a masterpiece of nature that reveals Gaudi’s boundless imagination.

La Pedrera is also the only Gaudi interpretation centre in Barcelona and is an essential place to visit in order to learn about the architect’s entire body of work and his inspiration. In total, you will tour 4,500 square metres divided across five floors. On this tour you will be able to discover for yourself during the day all the parts of the building open to visitors. ",es
10574,281767P52,entrance to Casa Batllo,"Discover Gaudí’s masterpiece, a UNESCO World Heritage site Your visit includes a full tour of this universal gem of architecture, as well as of the installations created by internationally renowned artists based on the legacy of an innovative and eternal genius.",es
10626,284316P44,Audio Guide in your phone ,"Discover the Gothic Quarter, the historic heart of Barcelona with its narrow streets, artisans, beautiful squares and famous buildings.

Your only guide for 1h30 ? Your smartphone.
The stories, designed by professional guides and actors, are automatically triggered from the Rewind app. Start whenever you want, alone or with others!

- Discover the Cathedral of Barcelona and the main monuments of the city
- Stroll through the small streets and beautiful squares of the district, source of inspiration for many film directors
- Learn about the vibrant history of Barcelona from Roman times to the present day
- Discover the old Jewish quarter of the city
- Get to know Santa Eulalia, co-patroness of the city and also Saint George, the patron saint of all Catalonia!",fr
10721,291969P2,Paddle; Kayak; Water; Guide,"Join our guides for the ultimate bat watching experience!

Our Sunset Bat Tour offers stunning views of the Downtown Austin Skyline, fun facts about the local bat colony, and the chance to see the 1.5 million Mexican Free-Tailed bats emerge from the famous bat bridge.

We are located minutes away from the Congress Avenue Bridge. ",id
10723,291969P5,Kayak; Paddles; Life Jackets,"Follow our experienced guides on a fun filled journey to Barton Springs! The natural spring fed water is a must see while in Austin. Not only will you see the clear waters, you will also see stunning views of the Downtown Austin Skyline. ",id
10757,299045P1,Licensed tour guide ,"Crimes The Tour is the walking tour through the old town with which you will discover the real crimes that most terrified the people of Barcelona for decades. You will walk through the Raval, the Gothic and the Born and we will reveal details that will not leave you indifferent. Nothing will ever be the same in Barcelona after Crimes.",fr
10911,305035P2,Live tour guide,"New York is one of the few cities in the world that offers emotions at any time of the year you decide to visit it but there is certainly a better time than the others and it is the month of December.

It is as if the big apple and Christmas become a single soul that finds its maximum expression in the famous neighborhood of Dyker Heights, in Brooklyn.

What is special about Dyker Heigths? The ability to experience Christmas, embracing it with a series of thematic decorations that cannot be expressed with words because the magic that this place offers is unique in its kind.

The owners of the houses in this neighborhood have been carrying on the tradition of lights for a long time and have made Dyker Heights a very important tourist destination.

Our Tour will take you to Brooklyn every day at 4:00 pm and for four hours you can immerse yourself in the brilliance and beauty that the illuminations of Dyker Heights will give you. The tour ends at Bryan Park (40 St & 6 Av).

",fr
10912,305035P3,Private guide,"New York is not just Manhattan but a multi-ethnic and cosmopolitan city that, thanks to our exclusive tour, you will be able to fully appreciate. The tour begins along the Hudson River, passing through the African-American neighborhood of Harlem until arriving in the Bronx in front of Yankee Stadium. After the external visit of the stadium, the tour continues in the heart of the Bronx at the graffiti “I love the Bronx” by Tats Cru in which the main symbols of New York are represented. Afterwards, we will stop at Arthur Avenue, famous for its “Little Italy” where it seems that time has never passed. The tour continues towards deep Queens passing through the Malba district until you reach Corona Park * to visit the famous “Unisphere”. The tour then takes you to Brooklyn passing through the Jewish quarter until you reach the Dumbo area where you can admire the panorama of Manhattan and the impressive Brooklyn Bridge. The tour ends in Manhattan's Little Italy.",ro
10958,306208P2,PADI Certification,Once you have completed this course you will be able to dive anywhere in the world! Can you imagine being able to discover the seabed when you travel to an exotic destination? You will be able to live in person being in an aquarium surrounded by colorful fish.,it
10965,30669P6,One General Admission Ticket,"Club Bonafide, founded in 2015 by world-renowned musician Richard Bona, is bringing live music back to 52nd Street! Hearkening back to the golden age of jazz in the 1930's, 40's & 50's, this eclectic venue features world-class artists performing a variety of musical genres including jazz, blues, funk, soul, latin, world and more.",de
10968,306964P2,Personal Guide,"Join our guided walking tour in Barcelona and explore the streets of this amazing city, where you will discover the architecture of the city throughout the Gothic quarter, the old town, the Ramblas and the renowned Passeig de Gràcia.

The history of Barcelona spreads out during a period of over 4.000 years. In more recent history, it's most known for being the home of the Sagrada Familia, the host city of the Olympic Games in 1992 and the home of FC Barcelona. 

As we move on from our meeting spot we’ll guide you through the center where we’ll encounter the Palau de la Música, Els 4 Gats before reaching Plaça Catalunya. 

The meeting point will be right in the middle of the Plaça Catalunya Square, please get the there on time!
",es
10969,306964P4,Personal Guide; Drink Deals; Fun Games; VIP Entrance to all venues,"The moment has arrived! 

It’s time for people to get together and enjoy social life, and in case you are looking for a night out in Barcelona, this is the place to go.

Join travelers, expats and locals together in a place where you will enjoy and experience Barcelona’s best bars and nightlife venues along with our team of local experts.

The tour includes free entrance to a night-club and a total of 3 shots (in some bars, only when you order a drink)!

Checklist:

ID - Please make sure that you carry your ID with you.
Attitude - Naturally we are here for a night out, but we’d like to ask you to not show up already drunk.
Dress Code - Smart Casual, no flip flops, sports shoes or tank tops.

Meeting point: 

The Shamrock
C/ dels Tallers, 72
Ciutat Vella, 
08001
Barcelona, Spain
",es
10970,306964P6,Tour Guide,"Join our guided walking tour in Barcelona and explore the streets of this amazing city, where you will discover the architecture of the city throughout the Gothic quarter, the old town, the Ramblas and the renowned Passeig de Gràcia.

The history of Barcelona spreads out during a period of over 4.000 years. In more recent history, it's most known for being the home of the Sagrada Familia, the host city of the Olympic Games in 1992 and the home of FC Barcelona. 

As we move on from our meeting spot we’ll guide you through the center where we’ll encounter the Palau de la Música, Els 4 Gats before reaching Plaça Catalunya. This square marks the starting point of the Passeig de Gràcia where you’ll experience some of Gaudi’s masterpieces such as La Pedrera or La Cassa Batlló.

The meeting point will be right underneath the Arc de Triomf monument.",fr
10976,307607P2,Premium kayak; Kayak paddles; Splash bag rentals (water resistant); Life jacket,"Immerse yourself in the awe-inspiring beauty of Austin's iconic Barton Creek on this 2.5-mile round-trip paddle accompanied by one of our experienced Tour Guides. 

With Downtown Austin as your backdrop, you'll paddle alongside the ever-popular Zilker Park on your journey to engage with the nature, wildlife, and natural history of Barton Springs – famous for its year-round 68-degree (f) water. 

Weather permitting, participants are encouraged to put themselves in the shoes of ancestors long before them who considered the waters of Barton Creek and Barton Springs of a sacred nature, by taking a quick dip in the shallow area at the headwaters of the creek. This public departure requires advanced registration and does not exceed 25 participants.",id
10978,307607P4,Premium Kayak; Kayak Paddles; Splash Bag Rentals (water resistant); Life Jackets,"Embark on our captivating Bat Paddle Guided Tour adventure to experience the infamous Mexican Free-Tailed Bats emergence from beneath the Congress Avenue Bridge in Austin, Texas!

Paddle along the picturesque waters of the Colorado River, exploring Austin's urban landscape. Our expert guides will lead you, sharing fascinating stories and insights along the way. As the sun sets, we'll navigate beneath the Congress Avenue Bridge, home to one of North America's largest urban bat colonies. Experience the breathtaking moment as millions of bats take flight, swirling above you in a mesmerizing dance against the twilight sky. Immerse yourself in the magic of this encounter, with the gentle sound of water and the scent of fresh air. Learn about these fascinating creatures, their role in the ecosystem, and conservation efforts. No kayaking experience required. We provide equipment and ensure your safety throughout the excursion.",id
11038,309298P1,Gratuities,"We offer a unique way to experience New York City, with small groups walking tours focused on often unexplored neighborhoods of this big city. You'll see through the eyes of licensed and experienced tour guides and longtime New Yorkers. 
The Tour ""Uptown in The Heights"" will let you explore a off-the-beaten-path area, a vibrant neighborhood rich of history. We will visit the Little Dominican area, that inspired Lin Manuel Miranda's ""In The Heights"" Broadway musical and movie. Let's take a walk around the old Frankfurt-on-Hudson neighborhood and discover what is left of the magnificent castles and luxurious estates. We will learn where the highest natural point of Manhattan is located and where the Battle of Fort Washington took place. The tour will culminate with breathtaking views of the Hudson River and the George Washington Bridge. 
Come explore Uptown Manhattan and leave with long last memories, knowledge and appreciation for this amazing part of New York City!",af
11039,309417P1,Gratuities,"If you're looking for the perfect ghost tour for the whole family, the Ghosts of Austin is perfect! We've designed this tour to be entertaining for anyone ages 5-100. Combining history with hauntings, this tour is Austin's #1 All-Ages/Family-Friendly Ghost Tour.

Your spooky adventure will begin with an introduction to Austin's haunted past - and then we'll head off to visit some of the most haunted locations in Austin.

If you have 10 or more guests in one group, please get in touch with the private & group sales coordinator with Ghost City Tours.",af
11040,309417P2,Gratuities,"The Murder by Gaslight Tour is our adults-only (16+) tour that explores the dark, dangerous, and spooky side of 19th Century Austin, TX. While enjoying a stroll through the historic district, you will hear chilling tales of violent deaths, suicide, serial killings, and ghosts who just refuse to check out of their hotels. This tour will discuss content that is not suitable for younger paranormal enthusiasts. 

If you have 10 or more guests in one group, please get in touch with the private & group sales coordinator with Ghost City Tours.",af
11049,309861P1,Entrance to Santa Cecilia de Monserrat € 12; Santa Cova Funicular 15.60,"A private tour with a native driver is always a special thing for someone who comes to visit Monserrat wanting to laugh and have fun.
",es
11071,31003P27,Local guide; Private tour,"Dig up Manhattan's spine-chilling past on this 2-hour private walking tour of Greenwich Village, known as one of the city's most haunted neighborhoods. Together with a guide, you'll head to some of the village's spookiest spots, including Washington Square Park and NYU's Brown Building, and hear tales of lost children, celebrity ghosts, and park-dwelling phantoms. ",pt
11088,31003P42,Guide,"Discover on this mid-town walk what made it that way; from two rival newspaper moguls who helped start an international war to some of the most iconic television studios you tune into daily. Your expert tour guide will seamlessly guide you through some of the most iconic areas of New York as you see where Saturday Night Live, the Daily Show with Trevor Noah, MTV Studios, Late Night with Stephen Colbert, the Tonight Show with Jimmy Fallon, and more take place.",es
11089,31003P5,Guide,"Dig up Manhattan's spine-chilling past on this 2-hour walking tour of Greenwich Village, known as one of the city's most haunted neighborhoods. Together with a guide, you'll head to some of the village's spookiest spots, including Washington Square Park and NYU's Brown Building, and hear tales of lost children, celebrity ghosts, and park-dwelling phantoms.",es
11130,31070P141,Audio guide; Access to La Pedrera; A FREE Barcelona city guide,"Admire a reconstruction of the Milà's original apartment, which shows how the inhabitants of this quirky masterpiece once lived
Climb curved stairwells to the roof terrace, marvel at the building's peculiar chimney pots, and see the city from a unique perspective",es
11165,310843P10,Tips,"You arrived in Paris for business or for pleasure, you would like to be mobile without thinking every hour where to get a taxi, your business meetings are far away from each others and you have no time to arrange your logistics. Our driver will pick you up at the indicated area and will accompany you for 4 hours in your shopping or business affairs in Paris. ",lt
