,PRODUCTCODE,pdt_inclexcl_ENG_CONTENT,pdt_product_detail_PRODUCTDESCRIPTION,pdt_inclexcl_ENG_CONTENT_lang
4354,15619P14,Entrance fees Louvre; Services of driver and guide,"Immerse yourself in the history the capital of fashion and glamour. Let's go back in time together ! Follow the river Seine from the Right and Left Bank and discover different Parisian atmospheres. We will go inside of Notre-Dame cathedral. We will drive around Concorde square and its Egyptian obelisk, Arc de Triomphe and its famous Champs-Elysées avenue, We will stop by Ladurée for its tasty ""macarons"".

Of course, you can't come to Paris without taking the best picture of the Eiffel Tower on Trocadero square! We will also stop in Montmartre, among the artists on ""Place du Tertre"".

During the day, guided tour of the Louvre museum (1 hour 30, Tickets INCLUDED).

For lunch, let's go to the Grand Colbert brasserie, or follow me on the outskirts of Paris to get lunch among some Chardonnay vineyards and get a visit in the local wineries, previously used as chalk quarries.",fr
4362,156203P1,Tourist guide services,The Financial District of Manhattan is not usually associated with colonial history and yet it's full of reminders about the events and people of 3 and 4 hundreds years ago. ,fr
4376,156610P5,"Japanese guide, vehicle fee, tax","*December only* limited time operation
This tour is the ONLY tour that takes you this many illumination spots in NY.

1. See how many illumination spots we take you, compare with other tours and you see the difference!

2. You can get off the tour vehicle to take the photograph outside, this is also the unique feature about our tour!

3. Don't forget to visit the largest Christmas Tree in New York! December is the most beautiful season in a year at New York.

4. The tour includes FREE ride back to your hotel (*see detail fro free transportation area)",af
4442,157275P28,Louvre Entrance Tickets ,"Louvre learn about the artists while strolling through the fascinating galleries. The Louvre Museum in Paris exhibits some of the most valuable works of art in the world. You are free to explore the Louvre at your leisure after the tour. See the world's most famous smile in Leonardo da Vinci's Mona Lisa. Learn about the fascinating history of the fascinating Louvre and its environs at the Louver Museum in Paris. City of the dream.
",fr
4446,157275P37,Cruise Tickets ,"We offer you and your a innovative tour, in which you will spend a full day getting to know more about our region
You will have the opportunity to see the natural wonders and enjoy the best views that these magnificent places can offer. 
We are experimented people who offer you a unique memories. This experience is not only wonderful but it is fascinating throughout its journey.
Do not miss the opportunity that we offer you to make this reservation and take some memories that will remain in your memory as the best vacations.
You will only have to relax and enjoy, we assure you comfort
",nl
4450,157275P43,Champagne ; ticket entrancy ,"We offer you an innovative tour, in which you will spend a 2 hours tour getting to know more about our region.
You will have the opportunity to see the natural wonders and enjoy the best views that these magnificent places can offer. 
We are experimented people who offer you a unique memories. This experience is not only wonderful but it is fascinating throughout its journey.
Do not miss the opportunity that we offer you to make this reservation and take some memories that will remain in your memory as the best vacations.
You will only have to relax and enjoy, we assure you comfort.",fr
4452,157275P49,Louvre Entrance Tickets ; All Fees and Taxes ,Louvre learn about the artists while strolling through the fascinating galleries. The Louvre Museum in Paris exhibits some of the most valuable works of art in the world. You are free to explore the Louvre at your leisure after the tour. See the world's most famous smile in Leonardo da Vinci's Mona Lisa. Learn about the fascinating history of the fascinating Louvre and its environs at the Louver Museum in Paris. City of the dream.,fr
4459,157275P58,tips ,"We offer the best Traditional Restaurant in Eiffel Tower with French meal on the first level of the Eiffel Tower. You will see the best view of the City of Lights enjoyable with French culture. 

From the Eiffel Tower, we invite you to take the time to experience Paris and to rediscover the cuisine that most resembles it: the one that transmits its spirit of sharing, celebrates diversity, and cultivates conviviality. It’s my kitchen, that of the brasserie. And since Paris 
comes alive at all hours, I welcome families, friends and lovers throughout the day, with pleasure, to make them experience a moment of happiness in a bright and contemporary decor.

Discover the magic of Paris in the evening on board of the Bateaux parisien a commented the best cruise over the Seine with Priority access to the Eiffel Tower.
",lv
4460,157275P60,Entrée; Fromage(s) ou dessert(s); Plat(s),"Enjoy a delicious 3-course dinner and live music on-board Read more about Bateaux parisien Seine River Paris by Night Dinner Cruise with Live Music - and the beautiful view of city of dream. and please see the amazing Menu on, what makes us unique so that you can book with us. scroll down on this product so that you can see our amazing Menu of the night. ",fr
4542,159229P4,Tour Guide; MY OTHER WALKS & ONLINE EXPERIENCES: French Revolution ; Napoleon ; Art Nouveau Architecture.,"During the years leading up to the French Revolution, Benjamin Franklin, John Adams and Thomas Jefferson lived in Paris. These great men made history in the United States but also impacted France’s. Why did the American colonies send such high profile Ambassadors to Paris as early as 1776? Let’s walk on their footsteps, along other figures who took part of the American War of Independence: Lafayette, Rochambeau, Thomas Paine, John Paul Jones and more.

Find out which one of these men was delighted to mingle with ladies at Versailles ; which one became a deputee at the National Assembly ; which one fought against his own nation to help the American cause ; and which men were imprisoned. You’ll see where they lived or died. We’ll explore decisive events such as the Treaty of Independence or the Louisiana Purchase with Napoleon!

Join me on a journey back in time with the U.S. Founding Fathers!

DETAILS: Adapted to all ages. Approx. 2hrs & 3,5Km/2Mi. Walk runs rain or shine. ",fr
4588,160210P1,Adventure Guide + Driver,"Get out of the city with friends, family or your significant other for a day of nature, wine and food. Most hill country tours you'll find are cheap, use a short bus for transportation and full of random people. This tour is exclusive to your group and thoughtful with a dedicated adventure guide, luxury transportation and reservation service. 

Highlights:
+Local guide who is dedicated to your group for the day.
+Hike to the top of Enchanted Rock in a state ran park where people have lived for 12,000 years. 
+Eat a picnic lunch (BYOL) in the park after the hike or dine at one of the quaint restaurants in downtown Fredericksburg.
+Visit to historic downtown Fredericksburg known for quaint shops and Texas wine.
+Drink wine at one of Central Texas' beautiful winery.
+Concierge service customizing your visit based on winery and food preference. 

We'll assign your Adventure Guide after booking who will communicate with you to determine your specific winery and meal plan. ",ro
4602,160696P10, Paris Louvre Museum: Priority Entrance ,"Immerse yourself in the world’s largest art museum and gain insight into the culture of France and the West

we provide option with audio guide as well ",fr
4604,160776P1,Catalan cava,"During our sunset sailing cruise you will participate in a unique sailing experience. You will enjoy 2 hours of sailing leaving and returning from Barcelonas beautiful Port Olimpic. We will sail out 3 to 4 miles and then tack back to sail against the sunset over the Montjuic. During our cruise you will enjoy free catalan cava. You can actively participate in the sailing event or just be carried along enjoying the cruise.

We leave from Barcelona Port Olimpic. Meeting point is at the Moll de la Marina 3. Once we leave the port we set the main sail and genoa sail and start sailing towards the November Buoy. There we tack and sail back enjoying the sunset. 

During our event you will get to learn the basic sailing procedures, enjoy a relaxing open air activity and have excellent and unique views of Barcelona",ca
4717,162634P1,mobile phone charger,"Upon arrival, our bilingual driver will meet you at the arrivals gate of Charles de Gaulle Airport (CDG) with a name. (Do not worry about flight delays! We use flight tracking and we will wait for you even if you are delayed for several hours!) Once you have met the driver, he will help you carry the luggage and guide you to the vehicle. Our vehicles are air-conditioned, non-smoking and spacious",fr
4719,162649P2,Excludes alcohol (available separately) Excludes Soda (available separately),"I’m a retired NYPD Detective born and raised in Little Italy. I’ve consulted for TV and major film productions on both crime and law enforcement. Together we will visit notorious Mafia and Crime locations in NYC (Manhattan). I enjoy sharing true crime stories of my police career and life experiences while growing up and working these streets coupled with amazing food from my neighborhood. We will visit notorious gangland locations while tasting some of the best local joints in the city. I’ve hosted over 7,000 guests, have been featured in multiple news outlets and have 1,500 five star reviews on Airbnb and am consistently the highest booked experience globally. I donate the proceeds to local organizations.",ca
4722,162649P5,Multi- Language Audio Guide,"Get SOLD OUT Pedestal tickets for PRIME 12:30 PM Reserved Access. — Our Premium Time Slot Reserved Access Statue of Liberty Tickets feature a professional concierge that will pick up your tickets so you won’t have to wait in the long lines. You will receive Reserved Line Access to the Statue of Liberty Pedestal, and Pedestal Museum including Ranger guided Liberty and Ellis Island tours and audio tours. Explore the immigration museum to hear the stories about the millions people that arrived in New York in search of a better life.",it
4724,162650P1,Smoking,experienced driver with knowledgeexperienced driver with great experience. Good knowledge of the city and knowledge of several foreign languages of several foreign languages,lt
4727,162650P4,smoking,"Great car park. Professional drivers with knowledge of several foreign languages in a good mood will

take you to your destination!",lt
4730,162655P3,Headsets ,Departing From Kearny NJ seeing all the sites in NJ and first stop Statue of Liberty and Skyline of NYC,nl
4732,162747P4,Tour Guide; Museum entrance is not included.,"I'm a 9/11 survivor, a member of the 9/11 Victims Compensation Fund. You will have my own experience of that day and the time afterward. I worked at what was then known as Ground Zero. A tour guide, I organized tour guides to give free walking tours to visiting first responders. 
You will be taken to places most guides don't know about: places where you can still see lingering damage from September 11, 2001.",fr
4750,163394P2,"Free fall suit (wetsuit, helmet, glasses, earplugs, and VR helmet) ...","iFLY has made the dream of stealing a reality. iFLY PARIS welcomes general public, companies and confirmed sportsmen for indoor free fall in the largest glass tube in the world.

360 ° VR experience:

Combine the experience of an indoor fall with that of an airplane jump, immersed in our VR helmet.

A breathtaking 360 ° view, above Dubai, Hawaii, California, the Swiss Alps during a jump with sports paratroopers.

From the age of 8.

Come 1 hour before your flight for your check-in.",nl
4781,164173P1,Tabla de paddle / Paddle board; Neopreno / wetsuit ,"Actividad única, amanecer desde el agua en la Barceloneta.

Ésta es una actividad única ya que somos pioneros en ofrecerla en aguas de Barcelona, nosotros le proporcionamos todo el material y el equipamiento para realizar esta experiencia. 

Special activity, sunrise from the Barceloneta beach

This is a unique activity and we are professionals doing this experience in Barcelona, we provide you all the staff for that experience.
",nl
4782,164215P1,Professional guide,"An old-fashioned carriage tour through Central Park is a unique way to enjoy NYC for first-time visitors, frequent travelers, and even local residents.

Whether you are sightseeing, celebrating a special occasion, or treating your family to a fun activity in the city, a carriage ride through one of America's most iconic public parks is sure to create lasting memories for you and your loved ones. 

Central Park Carriages is a family run business operating since 1979. We are very excited to share our love of New York and Central Park with you! ",it
4805,165390P1,Guide,"Join us on a captivating walk through the Catalan capital and world-class city of Barcelona, where we take an UNBIASED look at both sides of the Spanish political coin: to allow an avenue for Catalan independence versus the preservation of Spanish unity. When demonstrators shout ´Visca Catalunya!´ (Long Live Catalonia!), what lies behind those passionate cries? And how widespread is their support, remembering that Spain is both a former world empire, AND a fractured nation of 44 million people speaking 4 different languages. We’ll consider Catalonia’s annexation by Spain and France in the War of 1714, and its consistent cultural suppression since, most notoriously and recently under the infamous Fascist Spanish dictator, Francisco Franco. We investigate what possible resolutions can emerge from this standoff. Trust our guide to take you on a riveting journey - not only political in scope, but scenic and aesthetic in practice, as we enjoy a city area not saturated by common tourism.",es
4840,16637P13,Gratuities,"This tour provides the perfect opportunity to escape the city and see another side of Catalonia. Your guide will meet you in Barcelona city center and take you for the short coach journey, down the coast to Sitges. On arrival, you'll be provided with all the equipment you need, before setting out on the water for an afternoon of kayaking and snorkeling. You'll be accompanied by a qualified guide throughout and shown the best spots the coastline has to offer. The tour also includes a packed lunch and a complimentary beer or sangria on your return to the city. ",af
4850,16637P8,Welcome cava; 4 cocktails; Tapas; Professional mixologist,"Our fabulous cocktail masterclass will teach you four delicious cocktails, with recipes from our master mixologist that you can take home to impress your friends and family! You will meet in our city centre bar, where your professional barman will be waiting to make some cocktails to get those creative juices flowing. Over the experience our mixologist will teach you a variety of four cocktails, and to top the experience off you will also have be given tasty local tapas.",ca
4857,166458P6,ONEWHEEL material,"ONEWHEEL is something unique that no one else offers in Barcelona. It is not usual to find this type of tours anywhere, and it will be a tourist attraction that will allow you to visit several places in such a short time.",ro
4884,167726P1,Self-guided,"The Ruta del Pincho is the only route in Barcelona that takes you to know the best places of pinchos Carrer de Blai. The skewer is a northern tradition that we have made ours and we have taken it to a whole gastronomic offer within reach of a skewer. The tuta can be done by your gutter without the need of a guide. The reference points are already included in the meeting points of this activity.

There is no guide, you just have to follow the 6 points marked by TripAdvisor as a meeting point and you can visit the 6 most representative places of La Ruta Del Pincho. Additionally, only on Thursdays you can enjoy a special promotion that is a skewer plus a zurito for only € 2.

To enjoy!",af
4889,167876P5,Tickets ,"Your private driver will take care of you at the place of your choice. And bring you back.
You are alone, in a luxury vehicle (not in a bus.)
The driver will take you to the castle and give you an audio guide.
",sv
4947,168337P2,Dali Figueres Museum Tickets,"Worldwide known, Salvador Dalí, representative of surrealist painting, we can see in the museum of Figueres part of his works and works. In addition to understanding better what was one of his most inspiring scenarios, in this enclave of the Costa Brava as protagonist Cadaqués - Portlligat.
After the visit to the museum, we will go to Cadaqués, where we can travel the same streets as Dalí, and eat in one of the most spectacular places between the lighthouse of Cap de Creus and the waters of the Mediterranean Sea, at its easternmost point of the peninsula.
This visit will be unforgettable both for its artistic quality and for the magical surroundings of Alt Empordá.",de
4951,168387P2,Driver Animator,"A glass in your hand and pedals on your feet!

Get on board the Beer Bike of Demi Tour Paris!
With 3 drinks included per person,
This new unusual bike welcomes you for an unusual activity.
You are in a rolling bar for 10 people, including 6 cranks and 4 passengers!

You pedal, chat, laugh and drink while enjoying the breathtaking views of the capital.
Our team takes care of the rest and is there to make you spend an unforgettable moment!

Visit Paris differently, passing by the Arc de Triomphe, the Champs-Elysées, the Trocadero, the Eiffel Tower and the gardens of Avenue Foch.

An original activity, fun and green, to discover with friends, family or colleagues.",it
4952,168387P3,Big Bike 50min-1H; Driver Animator,"2 drinks per person

Hop aboard the Beer Bike, an osmosis between a rolling bar and the ultimate festive bike.

Imagine!
You walk in the most beautiful Parisian streets at the foot of the greatest monuments with the Arc de Triomphe and the Champs Elysees including a drink in hand and pedals to the feet!

Visit Paris from a new angle in a fun and original way with family or friends.",de
5019,169332P1,Facial,"This revitalizing facial is designed to re-balance and rejuvenate the skin. Skinova Medspa's experienced skin care specialists will provide a 50-minute facial which will be customized for individual client's needs. Facial Includes cleansing, steaming, exfoliation, extractions in the T Zone, facial massage, revitalizing mask, hydration, and toning. Skin will be left cleansed, rejuvenated and toned. 

Full comprehensive services are also available for upgrades; Such as Microdermabrasion, Deep Pore Cleansing, Chemical Peels, Oxygen Facial, LED Facial, Microneedling, Dermaplaning, and many more!

Skinova Medspa is a premier skin care and wellness center focusing on some of the latest innovative treatments and technologies.",es
5039,16949P21,Guide,"Booking of private Minivan with driver, for all your trips from Charles de Gaulle and Orly airport to Paris, hotel or apartment. The chauffeur will welcome you in your terminal arrival with a sign at your name, company logo or other distinctive sign.He will contact you by text for advise you of his arrival. The drivers speak English are professional with a license delivered by the transports ministry. 

This is a premium service, all vehicles are equipped with air conditioning, WiFi and refreshments. Your transfer will be carried in : 
Mercedes V-class (or similar) up to 7 passengers.

Contact us on info@citycabparis.com",es
5050,169999P1,Yoga Mat; Propinas,"Let´s start the day with some one hour power yoga at Barcelona Beach (for all levels) and share some fruits after practice! You will practice on a concrete platform so you won´t get sandy, and you will have the best ocean view!
Yoga mats provided.",tl
5053,170145P1,Live tour guide; Gratuites,"When we think of New York our minds inevitably leads us to view one of the most important of the Big Apple: the Brooklyn Bridge symbols.

Since 1883 this imposing building (which was long the world's longest suspension bridge) connects the island of Manhattan to Brooklyn and thanks to this tour you will have the chance to relive the history of New York destreggiandoti between Dumbo and Seaport up to an unforgettable walk on the deck at sunset.

The tour consists of two parts, the first Urban Explorer will take you in the heart of Brooklyn, where you will have the opportunity to visit the Dumbo dominated district, in the background, from the skyscrapers of Wall Street and enjoy right in the Downtown profile.

As we approach the sunset you will move toward the bridge where you will start a wonderful walk to Seaport Village (the historic heart of Manhattan) surrounded by unforgettable play of light and color.

The tour ends at Seaport Village.",fr
5146,171676P2,80HD Photos,"Private photo shoots in Paris
Get a professional photographer all for yourself and walk through the most romantic areas of the city during a private photo shoot. You are the star and Paris is the stage.",vi
5148,171778P2,Professional tour guide ,"Haunted Manhattan offers the most accurate—and FUN—ghost tours in the city! 

On our Greenwich Village tour, a secret underworld of ghosts and ghouls reveals itself as you’re guided through the streets by ""noted professor of anthropology & the supernatural,"" The Professor. 

The Professor will guide you to 13 haunted locations, from Washington Square Park, a former potter's field and now the beating heart of the Village that seems to host multiple famous spirits (including a ghost dog!), to the former home of Mark Twain that may also hold malevolent spirits, telling you tales of haunted dorm buildings, churches, fire houses, theaters, and more along the way...

A historical, hilarious, and completely hair-raising experience, Haunted Manhattan will show you the greatest city there is, like you’ve never seen it before. ",fr
5150,171778P4,An entertaining tour-guide!,"All Haunted Manhattan tours are led by entertaining, performative tour-guides knowledgeable of the histories and stories covered on our routes!",fr
5172,172138P3,Parking; Water,"Enjoy the mountain views, the cultural heritage on a tour of the Montserrat monastery on top of the mountain. This package is ideal for first-time visitors who want to experience all the highlights of Montserrat without the hassle of booking individual tickets or navigating public transportation. The logistics-covered tour gives visitors the opportunity to experience multiple highlights in one trip.",id
5179,172183P1,Helmet,"As a Parisian in love with my city, I am looking forward to showing you many secret places outside the crowded areas and as a fan of the new transport means, I will be offering you to do the tour with the best e-bike out there. 

Right from the start you will feel how magic is the experience of letting you go through the small streets of very authentic areas like the Marais or the Ile Saint Louis. I have been moving around Paris by bike for 10 years now so I know the safest roads through which you can discover special places. 

I will be happy to make a cool Video of you during the tour. Check my Instagram for see what kind of video @citylightriding. 

Don’t worry about the pace of the tour, Since I only do private groupe, you will decide how fast you want to go.
",fi
5187,172196P5,booklets-games,"This fun and cultural tour combines a city tour with a treasure hunt. For 2 hours, equipped with your game booklet, you will try to solve the mysteries by collecting clues. Each stop is punctuated with tourist explanations and anecdotes about the sites you will pass through, as well as a riddle to solve.
For this treasure hunt, here is your mission: find out who owns the safe we found in order to access the treasure. You will start in front of the Pantheon, then you will go down the Latin Quarter to the Cluny Museum. You will then go to Notre-Dame de Paris before solving the final enigma at the foot of the Louvre.
On arrival, you will have to decrypt the password which will allow you to access the treasure.
The tour is done independently but you can contact us at any time for help, if needed, we are never far away.
We're counting on you to unravel the mystery!",af
5224,172715P1,Tour guide,"Greenwich Village has long been one of New York’s signature neighborhoods, full of winding streets, gorgeous tree lined blocks, and an amazing array of characters who have called it home over the years. Starting in Washington Square Park and meandering through the West Village, this tour touches on the artistic, political and popular history of the area, including its famous role as the creative playground for many generations of bohemians.

We focus on telling great stories and making our tours like being shown around by an (exceptionally well-informed) friend. Educational and entertaining, this tour will show you why The Village is a place that has drawn people to it for generations.",fr
